Region,League,Year,Dataset,Team,Team_WAR,WAR_per_Game,W,L,GP,W_pct,Players
Americas,CBLOL,2025,Split 1 + Split 2 + Split 2 PO + Split 3,FURIA,57.99,1.074,30,24,54,0.5556,"Guigo, Tatu, Tutsz, Ayu, JoJo"
Americas,CBLOL,2025,Split 1 + Split 2 + Split 2 PO + Split 3,Isurus,35.09,0.731,23,25,48,0.4792,"Summit, Josedeodo, Leza, Snaker, Ackerman"
Americas,CBLOL,2025,Split 1 + Split 2 + Split 2 PO + Split 3,Leviatan,31.68,0.834,15,23,38,0.3947,"Zothve, SCARY, cody, ceo, ProDelta"
Americas,CBLOL,2025,Split 1 + Split 2 + Split 2 PO + Split 3,Fluxo W7M,-42.3,-1.41,4,26,30,0.1333,"Hidan, Ganks, Fuuu, Marvin, Guigs"
Americas,CBLOL,2026,Split 1 + Cup,FURIA,70.18,2.064,21,13,34,61.8,"Tatu, Guigo, Ayu, JoJo, Tutsz"
Americas,CBLOL,2026,Split 1 + Cup,Vivo Keyd Stars,48.76,1.741,13,15,28,46.4,"Boal, Mireu, Kaiwing, Disamis, Morttheus"
Americas,CBLOL,2026,Split 1 + Cup,Leviatan,43.19,1.309,12,21,33,36.4,"ceo, Enga, TopLop, Devost, Booki"
Americas,CBLOL,2026,Split 1 + Cup,RED Canids,39.75,1.282,21,10,31,67.7,"frosty, Kaze, fNb, Curse, Rabelo"
Americas,CBLOL,2026,Split 1 + Cup,LØS,33.48,1.24,15,12,27,55.6,"Zest, Ackerman, Drakehero, Feisty, Duduhh"
Americas,CBLOL,2026,Split 1 + Cup,LOUD,32.98,1.064,19,12,31,61.3,"xyno, Envy, YoungJae, Bull, RedBert"
Americas,CBLOL,2026,Split 1 + Cup,Fluxo W7M,29.62,1.481,8,12,20,40.0,"cody, BAO, Peach, Momochi, curty"
Americas,CBLOL,2026,Split 1 + Cup,paiN Gaming,23.46,0.902,6,20,26,23.1,"Trigger, Kuri, CarioK, Robo, tinowns"
Pacific,LCP,2025,Kickoff + Kickoff QS + Mid Season + Mid QS + Finals + Finals PO,Team Secret Whales,103.82,1.442,41,31,72,0.5694,"Hiro02, Hizto, Dire, Eddie, Taki"
Pacific,LCP,2025,Kickoff + Kickoff QS + Mid Season + Mid QS + Finals + Finals PO,CTBC Flying Oyster,94.32,1.209,60,18,78,0.7692,"Driver/Rest, JunJia, HongQ, Doggo, Kaiwing"
Pacific,LCP,2025,Kickoff + Kickoff QS + Mid Season + Mid QS + Finals + Finals PO,MVK Esports,85.97,1.131,43,33,76,0.5658,"Kratos, Gury, Kati, Shogun, SiuLoong"
Pacific,LCP,2025,Kickoff + Kickoff QS + Mid Season + Mid QS + Finals + Finals PO,PSG Talon,69.46,0.798,48,39,87,0.5517,"Azhi, Karsa, FoFo, Betty, Woody"
Pacific,LCP,2025,Kickoff + Kickoff QS + Mid Season + Mid QS + Finals + Finals PO,DetonatioN FocusMe,65.84,1.242,14,39,53,0.2642,"RayFarky, Guwon, Aria, Kakkun, Harp"
Pacific,LCP,2025,Kickoff + Kickoff QS + Mid Season + Mid QS + Finals + Finals PO,GAM Esports,65.39,0.828,41,38,79,0.519,"Kiaya, Levi, Aress/Emo, Artemis, Elio"
Pacific,LCP,2025,Kickoff + Kickoff QS + Mid Season + Mid QS + Finals + Finals PO,Chiefs Esports Club,27.91,0.594,9,38,47,0.1915,"BioPanther, Husha/Mir, JimieN, Violet/Leemas, Luon"
Pacific,LCP,2025,Kickoff + Kickoff QS + Mid Season + Mid QS + Finals + Finals PO,Fukuoka SoftBank HAWKS gaming,16.58,0.307,17,37,54,0.3148,"Evi, Courage, FATE, Marble, Gaeng"
Pacific,LCP,2026,Split 1 + PO + Split 2,Team Secret Whales,144.79,4.137,28,7,35,80.0,"Hizto, Eddie, Bie, Dire, Pun"
Pacific,LCP,2026,Split 1 + PO + Split 2,Fukuoka SoftBank HAWKS gaming,95.89,2.459,20,19,39,51.3,"Aria, Marble, Evi, Vsta, Van"
Pacific,LCP,2026,Split 1 + PO + Split 2,Deep Cross Gaming,85.51,1.943,24,20,44,54.5,"HongSuo, ShiauC, Flauren, Feng, POP9"
Pacific,LCP,2026,Split 1 + PO + Split 2,MVK Esports,79.41,2.941,13,14,27,48.1,"Shogun, Kati, Gury, Elio, Kratos"
Pacific,LCP,2026,Split 1 + PO + Split 2,CTBC Flying Oyster,63.48,2.189,12,17,29,41.4,"Shad0w, Doggo, Rest, Pungyeon, 2274"
Pacific,LCP,2026,Split 1 + PO + Split 2,GAM Esports,47.59,1.763,14,13,27,51.9,"Taki, Kiaya, Artemis, Aress, Draktharr"
Pacific,LCP,2026,Split 1 + PO + Split 2,Ground Zero Gaming,35.14,0.901,18,21,39,46.2,"1Jiang, Husha, Orca, Shunn, JimieN"
Pacific,LCP,2026,Split 1 + PO + Split 2,DetonatioN FocusMe,-112.93,-5.133,2,20,22,9.1,"Keine, Citrus, Momo, Kakkun, Gaeng"
